{
  "categories": ["dev"],
  "created_at": "2020-01-05 13:42:19.576875",
  "icon_url": "https://api.chucknorris.io/img/avatar/chuck-norris.png",
  "id": "RANDOM_ID",
  "updated_at": "2020-01-05 13:42:19.576875",
  "url": "https://api.chucknorris.io/jokes/RANDOM_ID",
  "value": "Chuck Norris can divide by zero."
}
